{
  "schema_version": "action-receipt-v1",
  "request": {
    "schema_version": "bound-action-v1",
    "request_id": "aaaaaaaa-bbbb-4ccc-8ddd-eeeeeeeeeeee",
    "manifest_id": "sha256:cd469f5218ffab6d979f5eb43233e90fbe3d81919f6c21169b57a95cbe69a6bd",
    "patch_id": "sts2-v0.107.1-59260271",
    "state_hash": "9727d9985c0144b6ee84344e3aab8553850e53c8e755e8b05e7d913a8d60e2e8",
    "action_id": "menu_select:ed10dff7281262e0"
  },
  "status": "dry_run",
  "reason": "validated_without_delivery",
  "message": "Bound action passed every guard; no action was delivered",
  "delivery_certainty": "not_applied",
  "automatic_retry_safe": false,
  "predecessor_state_hash": "9727d9985c0144b6ee84344e3aab8553850e53c8e755e8b05e7d913a8d60e2e8",
  "successor_snapshot": null,
  "bridge_response": null,
  "started_at": "2026-09-20T00:00:00Z",
  "completed_at": "2026-09-20T00:00:01Z"
}
